{"day_utc":"2026-02-18","engines":[{"engine_id":"C2_MEAN_REVERSION_EQ_V1","intent_count":0,"intent_hashes":[],"intent_type":"exposure_intent.v1"},{"engine_id":"C2_TREND_EQ_PRIMARY_V1","intent_count":0,"intent_hashes":[],"intent_type":"exposure_intent.v1"},{"engine_id":"C2_VOL_INCOME_DEFINED_RISK_V1","intent_count":0,"intent_hashes":[],"intent_type":"exposure_intent.v1"}],"inputs":{"engine_config_hashes":[],"market_calendar_hash":"","market_data_snapshot_hashes":[]},"produced_utc":"2026-02-18T00:00:00Z","producer":{"component":"ops/tools/run_intents_day_rollup_v1.py","git_sha":"c5c5d7cc851f30f3cd1786c21664c4f0c354f22c","version":"v1"},"rollup_sha256":"811e32597ea24e7bbcbdcd6be0ff5b1aa9ce383f200dd579a4d9629056bfc3af","schema_id":"intents_day_rollup.v1"}
